Petition,URL,State,Signatures Count
Save our pets from death on the roads Don't Ban Containment Systems,https://petition.parliament.uk/petitions/214766,closed,1919
Require Schools in England to teach & sing the National Anthem once a week,https://petition.parliament.uk/petitions/214772,closed,15
Make nonconsensual medical intervention for intersexed people illegal.,https://petition.parliament.uk/petitions/214782,closed,10
Ban the removal of non farmed fresh water course fish for use as food.,https://petition.parliament.uk/petitions/214793,closed,103
Raise awareness of Mental illness in the South Asian and Islamic communities,https://petition.parliament.uk/petitions/214794,closed,12
Ban plastic cotton buds,https://petition.parliament.uk/petitions/214795,closed,42
Raise the minimum wage for workers under 18 years old.,https://petition.parliament.uk/petitions/214810,closed,52
Stop plans to cut Cannon Street trains on the Hayes (Kent) train line,https://petition.parliament.uk/petitions/214832,closed,916
To grant 6yr old epilepsy sufferer Alfie Dingley a licence for medical cannabis.,https://petition.parliament.uk/petitions/214834,closed,123
Get Deaf Road Warning signs onto our streets.,https://petition.parliament.uk/petitions/214837,closed,93
Ensure vics of CSA under UK est care get full legal redress like NSW & Victoria,https://petition.parliament.uk/petitions/214843,closed,25
Create a scheme that encourages those receiving state benefits to litter pick,https://petition.parliament.uk/petitions/214851,closed,63
"Ensure all gig economy workers get holiday pay, sick pay, and minimum wage",https://petition.parliament.uk/petitions/214852,closed,2402
The abolition of Audit total exemption for small private limited companies.,https://petition.parliament.uk/petitions/214855,closed,9
Lower the legal sex age to 15 years of age.,https://petition.parliament.uk/petitions/214865,closed,17
Stop funding the BBC with taxpayer money,https://petition.parliament.uk/petitions/214867,closed,128
Ban over taking on the A35 one of Dorset’s most dangerous roads!,https://petition.parliament.uk/petitions/214882,closed,25
Revoke journalist Lauren Southern's ban from the United Kingdom.,https://petition.parliament.uk/petitions/214886,closed,203
All children aged 16 to 19 in further education should be entitled to EMA,https://petition.parliament.uk/petitions/214896,closed,139
"Move the last Bank Holiday in May, into June",https://petition.parliament.uk/petitions/214904,closed,2484
Introduce a requirement for address verification for internet applications,https://petition.parliament.uk/petitions/214917,closed,11
Abolish the killing of stray animals in Council shelters!,https://petition.parliament.uk/petitions/214922,closed,3746
Allow student nurses to receive the 30 hours funding for childcare,https://petition.parliament.uk/petitions/214933,closed,486
Stiffer sentencing and more resources for the police to prioritise tool theft.,https://petition.parliament.uk/petitions/214934,closed,363
"The holiday  homes industry to have tighter, stricter regulations.",https://petition.parliament.uk/petitions/214936,closed,3300
Restrict social media use by children to help prevent cyberbullying,https://petition.parliament.uk/petitions/214944,closed,12
ban homework,https://petition.parliament.uk/petitions/214951,closed,48
Make it illegal to charge a single room supplement,https://petition.parliament.uk/petitions/214960,closed,230
Introduce a standardised 'no added sugar' label,https://petition.parliament.uk/petitions/214962,closed,15
Extend gender pay gap reporting rules to cover ethnicity pay gap,https://petition.parliament.uk/petitions/214965,closed,1555
Full-scale independent inquiry into mismanagement of all UK rail transport.,https://petition.parliament.uk/petitions/214966,closed,70
To implement a fishery licence to shoot a maximum of 3 otters a year.,https://petition.parliament.uk/petitions/214967,closed,24
Parliament to change the law regarding council tax,https://petition.parliament.uk/petitions/214986,closed,200
"Make it illegal for school toilets to have no soap, toilet paper, or locks",https://petition.parliament.uk/petitions/214998,closed,119
The UK Government to introduce a ban on all non-recyclable packaging from 2022.,https://petition.parliament.uk/petitions/215000,closed,32010
Abolish the 'Tampon Tax' once the UK has left the European Union.,https://petition.parliament.uk/petitions/215003,closed,245
Abolish changes to free school meals,https://petition.parliament.uk/petitions/215007,closed,713
Include an option to state disagreement with a petition on the petition website.,https://petition.parliament.uk/petitions/215024,closed,18
New law on the ratio of qualified staff/carers to patients in nursing homes,https://petition.parliament.uk/petitions/215051,closed,44
Let contraceptives be sold over-the-counter,https://petition.parliament.uk/petitions/215054,closed,12
Make first aid&basic life support a legal requirement for junior school children,https://petition.parliament.uk/petitions/215084,closed,283
Invite Vladimir Putin to the UK to discuss UK-Russia relations,https://petition.parliament.uk/petitions/215120,closed,18
Fund retraining of local authority health officers at every level,https://petition.parliament.uk/petitions/215129,closed,13
House of Lords party appointments would be tied to General Election results.,https://petition.parliament.uk/petitions/215134,closed,526
"All EU powers should return to Scotland, Wales and Northern Ireland after Brexit",https://petition.parliament.uk/petitions/215138,closed,13
"Issue an official apology to Lauren Southern for denial of entry into the UK
",https://petition.parliament.uk/petitions/215141,closed,45
Introduce consequences of prolonged pornography use into sex education,https://petition.parliament.uk/petitions/215155,closed,53
Establish 14th March as a public holiday,https://petition.parliament.uk/petitions/215161,closed,24
Mandate to install standard microfiber filters in washing machines,https://petition.parliament.uk/petitions/215169,closed,819
"Allow Brittany Pettibone, Lauren Southern, and Martin Sellner entry to the UK.",https://petition.parliament.uk/petitions/215204,closed,12717
Ban the use and sale of all non-recyclable plastics in the UK by 2025,https://petition.parliament.uk/petitions/215212,closed,29
"Ban the sale, and use of any tool designed to cause pain/fear in training dogs.",https://petition.parliament.uk/petitions/215216,closed,115
Begin talks to expel Russia from the UN security council,https://petition.parliament.uk/petitions/215223,closed,46
Encourage British Sign Language in KS1 in Schools,https://petition.parliament.uk/petitions/215226,closed,255
Give all women the choice of an Induction at 41 weeks of Pregnancy.,https://petition.parliament.uk/petitions/215228,closed,42652
Increase Statutory Maternity Pay (SMP) from 39 weeks to 52 weeks,https://petition.parliament.uk/petitions/215229,closed,55
Abolish all subsidies for shotgun and firearms licences,https://petition.parliament.uk/petitions/215238,closed,4452
Make it a requirement of law to label all Halal certified products as such.,https://petition.parliament.uk/petitions/215241,closed,4264
Make sure that there are recycling bins in the classrooms of every school.,https://petition.parliament.uk/petitions/215244,closed,42
Make lymph sparing liposuction for lipedema available on the NHS,https://petition.parliament.uk/petitions/215252,closed,2342
Ban the sale and farming of non-free range eggs.,https://petition.parliament.uk/petitions/215261,closed,17
Legislate to give wheelchair users priority access to bus wheelchair spaces,https://petition.parliament.uk/petitions/215270,closed,233
Start a voluntary emigration programme for people who want to leave the UK.,https://petition.parliament.uk/petitions/215272,closed,11
"Change the Law, to stop authorities euthanising animals before an assessment.",https://petition.parliament.uk/petitions/215274,closed,2238
Make A levels 3 years. This is to avoid psychological stress for young people.,https://petition.parliament.uk/petitions/215277,closed,14
Make middle rate DLA a base rate for children with Cystic fibrosis.,https://petition.parliament.uk/petitions/215278,closed,324
Incorporate LGBT+ history in primary and secondary school education,https://petition.parliament.uk/petitions/215297,closed,452
Public enquiry into child sexual abuse and exportation in Cleveland,https://petition.parliament.uk/petitions/215299,closed,13
Reduce the school days to just four days a week.,https://petition.parliament.uk/petitions/215317,closed,605
Do not make any changes to the current devolution arrangements,https://petition.parliament.uk/petitions/215318,closed,10
"Treat knife crime as a health issue, to tackle the current epidemic in London.",https://petition.parliament.uk/petitions/215335,closed,204
Change the methods the Government use to record Homelessness,https://petition.parliament.uk/petitions/215338,closed,41
Lower the driving age to 15,https://petition.parliament.uk/petitions/215339,closed,30
Reduce the age of Breast Screening to 25-30,https://petition.parliament.uk/petitions/215343,closed,28935
"Raise awareness of endometriosis, for all women 18 to 60 +",https://petition.parliament.uk/petitions/215345,closed,14
Remove defensive architecture to help homeless people sleep safely,https://petition.parliament.uk/petitions/215359,closed,11
Urge the FCA to cap repayments on rent-to-own and doorstep lending,https://petition.parliament.uk/petitions/215364,closed,1393
Stop unfair ILR cancellation for ECAA Agreement.,https://petition.parliament.uk/petitions/215370,closed,5736
make wrongly reporting someone to a law enforcement agency a criminal offence,https://petition.parliament.uk/petitions/215375,closed,65
Get the transport secretary to review the C2C rail contract.,https://petition.parliament.uk/petitions/215378,closed,756
Ban Standing Charges on all Energy and Water Bills,https://petition.parliament.uk/petitions/215379,closed,421
Bring back the convalescent homes in the UK,https://petition.parliament.uk/petitions/215382,closed,30
Introduce Religious Studies/ REPS as an EBacc humanity subject,https://petition.parliament.uk/petitions/215412,closed,9
Make anti-GD2 treatment available on the NHS,https://petition.parliament.uk/petitions/215415,closed,30387
large vehicle awareness a mandatory part of obtaining a small vehicle licence,https://petition.parliament.uk/petitions/215433,closed,7
Reject plans to build a massive solar farm on Graveney Marshes in Kent.,https://petition.parliament.uk/petitions/215451,closed,1292
Increase the driving age to 21,https://petition.parliament.uk/petitions/215459,closed,15
Ban balloons for marketing/business use  immediately.,https://petition.parliament.uk/petitions/215481,closed,32
Change when employers can dismiss employees without cause back to one year.,https://petition.parliament.uk/petitions/215501,closed,18
I want the employees' contracts with zero hours to disappear.,https://petition.parliament.uk/petitions/215506,closed,93
Introduce a charge for all foreign vehicles using roads in the UK.,https://petition.parliament.uk/petitions/215511,closed,124
The EU referendum result must be dismissed as not fit for purpose,https://petition.parliament.uk/petitions/215550,closed,5362
OFSTED to closely monitor training qualifications provided by care organisations,https://petition.parliament.uk/petitions/215552,closed,22
Clearing pavements of ice should not bring legal liability if someone then falls,https://petition.parliament.uk/petitions/215562,closed,32
Take all income into account when calculating for Child Maintenance payments,https://petition.parliament.uk/petitions/215581,closed,82
Commemorate the life of Stephen Hawking with a day of national mourning.,https://petition.parliament.uk/petitions/215582,closed,23
Abolish university fees,https://petition.parliament.uk/petitions/215587,closed,28
Cap the price of private and university owned student accommodation,https://petition.parliament.uk/petitions/215599,closed,10
Release the 'Implementation Unit Report on Shale Gas' (2016) immediately.,https://petition.parliament.uk/petitions/215601,closed,2034
Ban the sale of unnecessary single use plastics in UK shops.,https://petition.parliament.uk/petitions/215609,closed,354
Make prescriptions free for cystic fibrosis sufferers,https://petition.parliament.uk/petitions/215619,closed,1298
Allow supply teachers to pay into the 'Teachers' Pension'.,https://petition.parliament.uk/petitions/215627,closed,32
Provide free sanitary products to young women receiving free school meals,https://petition.parliament.uk/petitions/215628,closed,1131
"Decriminalise, legalise and regulate cannabis for medicinal and recreational use",https://petition.parliament.uk/petitions/215640,closed,1043
UK Government to implement the Bercow: Ten Years On recommendations,https://petition.parliament.uk/petitions/215643,closed,11621
Allow fast food delivery drivers access to bus lanes during operating hours.,https://petition.parliament.uk/petitions/215644,closed,9
"Inquiries into rape, abuse and systematic grooming of children be independent",https://petition.parliament.uk/petitions/215650,closed,205
Debate harmful effects of Balloon releasing.,https://petition.parliament.uk/petitions/215662,closed,17
'Method of Slaughter' to be displayed on fresh/frozen meat and poultry.,https://petition.parliament.uk/petitions/215666,closed,872
Make all companies provide an e mail address as a point of contact,https://petition.parliament.uk/petitions/215667,closed,16
Conduct rolling referenda so that the Brexit deal commands support AT THE TIME,https://petition.parliament.uk/petitions/215671,closed,17
Please give every child in England the opportunity to study Classics.,https://petition.parliament.uk/petitions/215689,closed,45
To debate the impact of not returning FULL control of our fisheries to the UK.,https://petition.parliament.uk/petitions/215702,closed,26
Stop the Iraq Fatality Investigations (IFI).,https://petition.parliament.uk/petitions/215715,closed,2425
Give a mandatory lifetime driving ban for causing death by dangerous driving,https://petition.parliament.uk/petitions/215721,closed,1911
Regulate supported housing and hostels.,https://petition.parliament.uk/petitions/215743,closed,30
Amend Hate Speech Laws,https://petition.parliament.uk/petitions/215744,closed,50
Give students in unaffordable cities larger student loans for unaffordable rent.,https://petition.parliament.uk/petitions/215746,closed,25
For Student Finance England to acknowledge their mistakes with payment errors!,https://petition.parliament.uk/petitions/215770,closed,49
Abolish the 3-month rule so that people receiving chemotherapy can obtain PIP,https://petition.parliament.uk/petitions/215775,closed,5716
Start development of a satellite carrier rocket.,https://petition.parliament.uk/petitions/215781,closed,12
Ban balloon and sky / chinese lantern releases.,https://petition.parliament.uk/petitions/215782,closed,34153
Amend the Gender Recognition Act 2004 to remove the need for a medical diagnosis,https://petition.parliament.uk/petitions/215786,closed,45
Increase paternity leave so it is 3 months off on full pay.,https://petition.parliament.uk/petitions/215791,closed,96
Make the using mobile phone whilst driving punishment the same as drink driving.,https://petition.parliament.uk/petitions/215794,closed,16
A Referendum on EU Leaving Deal,https://petition.parliament.uk/petitions/215795,closed,66
Halt the UK badger culls and provide key data on previous culls.,https://petition.parliament.uk/petitions/215797,closed,7558
Increase armed forces budget,https://petition.parliament.uk/petitions/215801,closed,12
Introduce seller identity check and records of item for cash for gold shops,https://petition.parliament.uk/petitions/215809,closed,2157
Give anyone who has a long-term health condition medication on the NHS,https://petition.parliament.uk/petitions/215825,closed,16
Ban the sale of single use plastic straws and cutlery in England,https://petition.parliament.uk/petitions/215863,closed,4455
Make Makaton a compulsory part of Early Years and Primary Education in the UK.,https://petition.parliament.uk/petitions/215872,closed,8123
"Ban exams, instead get graded for classwork.",https://petition.parliament.uk/petitions/215898,closed,40
Abolish school uniform in all schools.,https://petition.parliament.uk/petitions/215908,closed,42
Introduce an Act making it mandatory to manufacture British passports in the UK.,https://petition.parliament.uk/petitions/215924,closed,47
"Lower the math entry requirement to a Grade D, to access teacher training.",https://petition.parliament.uk/petitions/215953,closed,11
Remove Homework in all primary schools in England,https://petition.parliament.uk/petitions/215956,closed,16
Don't ban single use plastic straws for disabled people.,https://petition.parliament.uk/petitions/215968,closed,94
Urge the FA to withdraw the England team from the World Cup this summer.,https://petition.parliament.uk/petitions/215978,closed,20
Make it compulsory for vendors to produce a Home Survey prior to marketing,https://petition.parliament.uk/petitions/215983,closed,10
Stop Southeastern Trains (Govia) from being awarded  franchise renewal.,https://petition.parliament.uk/petitions/216011,closed,1710
Stop UK coastal crude oil pollution threat; ban Colter offshore oil rig.,https://petition.parliament.uk/petitions/216012,closed,1061
Mandate display of plastic:food volume ratio on all packaged foods items.,https://petition.parliament.uk/petitions/216013,closed,28
Local councils  to provide drinking fountains in towns and cities.,https://petition.parliament.uk/petitions/216017,closed,125
Make it illegal to smoke within 10 metres of a dwelling if it is hotter than 25C,https://petition.parliament.uk/petitions/216043,closed,22
Less burden of proof for post war commonwealth citizens seeking  naturalisation,https://petition.parliament.uk/petitions/216045,closed,250
Stop providers of Buy to Let mortgages discriminating against benefits claimants,https://petition.parliament.uk/petitions/216052,closed,73
Introduce LGBT+ education to the primary curriculum in schools,https://petition.parliament.uk/petitions/216059,closed,17
Make boxing safer/ Save lives,https://petition.parliament.uk/petitions/216069,closed,1975
Provide more government funding to help our struggling hospices to survive.,https://petition.parliament.uk/petitions/216079,closed,90
Provide nationwide equal access to suitable wheelchairs to all who need one.,https://petition.parliament.uk/petitions/216081,closed,47
To make labeling commercial food as vegetarian and/or vegan a legal requirement,https://petition.parliament.uk/petitions/216082,closed,1730
Make financial management a compulsory part of education in schools,https://petition.parliament.uk/petitions/216089,closed,11
Prohibit the removal of trees/shrubs from riverbanks & in-river wildlife habitat,https://petition.parliament.uk/petitions/216090,closed,2959
Introduce Emotional Assistance Pet Act to prevent suicides and help families!,https://petition.parliament.uk/petitions/216091,closed,20
Improve access to healthcare for homeless people,https://petition.parliament.uk/petitions/216099,closed,70
Have GMT all year round.,https://petition.parliament.uk/petitions/216122,closed,27
stop car insurance companies increasing premiums for no-fault accidents,https://petition.parliament.uk/petitions/216135,closed,67
Bring Back Capital Punishment For Convicted Terrorists.,https://petition.parliament.uk/petitions/216145,closed,39
Eliminate the use of black plastic in food packaging.,https://petition.parliament.uk/petitions/216173,closed,936
Bring back nit nurse to UK schools send them home till treated and clear 2018,https://petition.parliament.uk/petitions/216175,closed,15
Working people should be awarded 100% of the non working partners tax allowance,https://petition.parliament.uk/petitions/216176,closed,24
Outdoor nature-based learning to be compulsory and weekly in all English schools,https://petition.parliament.uk/petitions/216187,closed,1164
Hold a referendum to determine the will of the people for NHS and care funding.,https://petition.parliament.uk/petitions/216188,closed,54
Debate scrapping the television licence fee and discuss other funding options.,https://petition.parliament.uk/petitions/216189,closed,60
Change the law and policy concerning box junctions.,https://petition.parliament.uk/petitions/216204,closed,19
New law that cats injured/killed by a vehicle are checked for a chip: Round 2,https://petition.parliament.uk/petitions/216215,closed,15057
Amend Highways act 1980 to allow electric powered motorcycles to use motorways,https://petition.parliament.uk/petitions/216231,closed,15
Mandatory weekly hour classes in current politics in secondary schools.,https://petition.parliament.uk/petitions/216233,closed,14
Fund and support a monument to the POLISH PILOT HEROES of the Battle of Britain.,https://petition.parliament.uk/petitions/216235,closed,11872
Ban the production and sale of non-recycled toilet paper in this country.,https://petition.parliament.uk/petitions/216244,closed,14
Stop all animal testing in the UK,https://petition.parliament.uk/petitions/216278,closed,70
"If you are an English citizen, you should not have to pay to attend university.",https://petition.parliament.uk/petitions/216280,closed,16
Reverse the changes to allow for Textiles & Technology to be stand alone GCSEs.,https://petition.parliament.uk/petitions/216289,closed,7439
Make up-skirt photography an illegal offence in the UK,https://petition.parliament.uk/petitions/216290,closed,2445
Make food manufacturers include the potassium content and Phosphate on labels.,https://petition.parliament.uk/petitions/216296,closed,24
Make the judgement and discrimination of mental illness unlawful.,https://petition.parliament.uk/petitions/216300,closed,34
Student Finance made available for part time Paramedic degree,https://petition.parliament.uk/petitions/216302,closed,135
Remove Chris Brown’s ban from the U.K. and allow him access to the country.,https://petition.parliament.uk/petitions/216306,closed,42
Start charging for non-emergencies in A & E across the U.K,https://petition.parliament.uk/petitions/216312,closed,13
Impose a safety check on all animal toys,https://petition.parliament.uk/petitions/216323,closed,13
Revise and implement strategies to improve the quality of life for care leavers,https://petition.parliament.uk/petitions/216328,closed,531
Change business rates for child care providers and make them zero VAT rated.,https://petition.parliament.uk/petitions/216337,closed,10915
We want a public enquiry into whether children are needlessly taken into care,https://petition.parliament.uk/petitions/216341,closed,246
Issue legal guidance that IVA completion certificates should be issued promptly,https://petition.parliament.uk/petitions/216366,closed,152
Scrap the charges for child arrangement applications,https://petition.parliament.uk/petitions/216367,closed,116
NHS to provide badges for chronically/long term ill people for public transport,https://petition.parliament.uk/petitions/216369,closed,60
Make students in the uk pay council tax in the city that they study and live.,https://petition.parliament.uk/petitions/216400,closed,130
Increase the amount of support given to sexual assault and rape victims.,https://petition.parliament.uk/petitions/216406,closed,114
Mandatory training in ALL aspects of Domestic abuse for Family courts & Cafcass.,https://petition.parliament.uk/petitions/216416,closed,3949
Improve mental healthcare provisions available for prisoners,https://petition.parliament.uk/petitions/216421,closed,12
Base income tax on combined household income for a fair tax system,https://petition.parliament.uk/petitions/216429,closed,77
Give all UK residents the right to vote in local government elections,https://petition.parliament.uk/petitions/216433,closed,514
"Stop roll out of ""Academies"" to SEN schools.",https://petition.parliament.uk/petitions/216437,closed,15
Referendum on whether to scrap the TV license,https://petition.parliament.uk/petitions/216439,closed,105
Don't allow councils to use private companies as Civil Enforcement Officers,https://petition.parliament.uk/petitions/216443,closed,17
Stop Myxomatosis killing wild Rabbits by developing a lifetime vaccine,https://petition.parliament.uk/petitions/216445,closed,249
All children should be tested for Autism before they are five years old,https://petition.parliament.uk/petitions/216456,closed,50
Cap council tax at 2% per annum maximum from 2019 onwards,https://petition.parliament.uk/petitions/216457,closed,40
Make it compulsory that new borns have a heart scan before leaving hospital,https://petition.parliament.uk/petitions/216461,closed,1892
Raise the Penalty for Uninsured Motorists,https://petition.parliament.uk/petitions/216464,closed,15
Encourage schools to expell students who are bullying others.,https://petition.parliament.uk/petitions/216481,closed,43
"Introduce a reassuring EM radiation limit for homes and schools (eg 1,000 µW/m2)",https://petition.parliament.uk/petitions/216492,closed,111
Add Multiple Sclerosis to the Medical Exemption list,https://petition.parliament.uk/petitions/216496,closed,15346
Make sign language part of the national curriculum,https://petition.parliament.uk/petitions/216511,closed,337
The right to register with two GPs for students studying away from home,https://petition.parliament.uk/petitions/216526,closed,57
Make banks directly responsible for contacting those who have been missold PPI,https://petition.parliament.uk/petitions/216527,closed,40
Return funding for sixth form students for the last three financial years,https://petition.parliament.uk/petitions/216530,closed,20
